{
  "schemaVersion": "kaleidosphere/k4c-terminal-evidence-receipt/v1",
  "fixture": "tests/fixtures/release/k4c-evidence-sets-v1.json",
  "fixtureSha256": "a27e2a2a21e5587fe4e85e0467971efd972e88755764b8fcc827544b5f54d1fe",
  "package": {
    "name": "kaleidosphere",
    "version": "0.24.0",
    "title": "KaleidoSphere",
    "digest": "9482367f2c671665651ed1ec55f6aa852bacfc151a36f14eb9807afbf3c185f4",
    "manifestSha256": "beb78cef8fbedb1817fbf3fc61c96177a7e1a7e28b910838b7bf5070eb47fc75"
  },
  "validatedInputDigests": {
    "local": {
      "path": "verification/k4c/local-contract-integration-v1.json",
      "expectedSha256": "fbceca64eed503259c66b8de8109a938a7849258e716d8202dac147ab82eafd6",
      "observedSha256": "fbceca64eed503259c66b8de8109a938a7849258e716d8202dac147ab82eafd6"
    },
    "packet": {
      "path": "docs/release/k4c-reviewer-test-cases-v1.json",
      "expectedSha256": "791cafe683e8d1a57d43bcaec99f2805800588c70bd6a268db158243226b1b6a",
      "observedSha256": "791cafe683e8d1a57d43bcaec99f2805800588c70bd6a268db158243226b1b6a"
    },
    "portal": {
      "path": "verification/k4c/portal-submission-receipt-v1.json",
      "expectedSha256": "16def76684b97fb1a3aca03d12c19bcd551940dbb44dbac44d9326dcbaf9e102",
      "observedSha256": "16def76684b97fb1a3aca03d12c19bcd551940dbb44dbac44d9326dcbaf9e102"
    },
    "anonymous": {
      "path": "verification/k4c/anonymous-directory-readback-v1.json",
      "expectedSha256": "6d1587967b921ebc46480fe5439c7e3f40026d167224434bb36c7ae4283b548e",
      "observedSha256": "6d1587967b921ebc46480fe5439c7e3f40026d167224434bb36c7ae4283b548e"
    }
  },
  "portalOutcome": {
    "captured": true,
    "disposition": "PRECHECK_READY",
    "identityStepRecorded": false
  },
  "anonymousProof": {
    "present": true,
    "discovery": true,
    "install": true,
    "fresh": true,
    "boundaryClean": true,
    "complete": true,
    "publicListingClaim": true
  },
  "disposition": "RELEASED",
  "reason": "complete same-digest local, packet, portal, and anonymous receipts validated; anonymous discovery and install proof is fresh and boundary-clean",
  "evidence": [],
  "resumeActions": [],
  "rollback": "Safe rollback when authorized: remove the local cache, or withdraw the draft and publish the corrected successor.",
  "side_effects": [],
  "nonClaims": [
    "No portal submission, publication, listing, identity, credential, or release operation is performed or established by this classifier.",
    "A terminal disposition is emitted only when complete same-digest local, packet, portal, and anonymous receipts are validated; a public listing claim then requires the complete anonymous directory discovery and install evidence.",
    "This record is a bounded local classification of recorded evidence; it creates no external state and performs no mutation."
  ]
}
